{"schemaVersion":"environment-cost-server-topology-1.0","areaId":"route-server-fixture","graphFingerprintSha256":"4444444444444444444444444444444444444444444444444444444444444444","coordinateReferenceSystem":{"geometryEpsg":4326,"axisOrder":["longitude","latitude"],"projectedEpsg":6677,"coordinateZoneId":9,"unityAxisConvention":"EUN","referencePointGeographic":[139.7355,35.69]},"counts":{"nodeCount":6,"physicalEdgeCount":6,"directedEdgeCount":12},"nodes":[[2001,139.735,35.69],[2002,139.7355,35.6902],[2003,139.7355,35.69],[2004,139.7355,35.6898],[2005,139.736,35.69],[2006,139.7355,35.6907]],"physicalEdges":[["osm-way-201-0",["osm-way-201-0"]],["osm-way-202-0",["osm-way-202-0"]],["osm-way-203-0",["osm-way-203-0"]],["osm-way-204-0",["osm-way-204-0"]],["osm-way-205-0",["osm-way-205-0"]],["osm-way-206-0",["osm-way-206-0"]]],"directedEdges":[[0,1,0,1,140,100],[0,0,1,0,140,100],[1,4,1,1,140,100],[1,1,4,0,140,100],[2,2,0,1,161,115],[2,0,2,0,161,115],[3,4,2,1,161,115],[3,2,4,0,161,115],[4,3,0,1,210,150],[4,0,3,0,210,150],[5,4,3,1,210,150],[5,3,4,0,210,150]],"contentFingerprintSha256":"bbe3375890f4d9fe3c63e2c559136f48d20e7d6e55238782c28f1faef466ea14"}
